{
  "$schema": "http://json-schema.org/draft-07/schema#",
  "$id": "https://github.com/RintaroMatsumoto/human-persona/config/schema.json",
  "title": "HumanPersona Configuration Schema",
  "description": "Language-agnostic schema for defining human-like AI persona behavior. Derived personas inherit from this structure.",
  "type": "object",
  "required": [
    "meta",
    "timing",
    "style",
    "emotion"
  ],
  "properties": {
    "meta": {
      "type": "object",
      "description": "Persona metadata — identity and cultural context.",
      "required": [
        "persona_id",
        "language",
        "context_culture"
      ],
      "properties": {
        "persona_id": {
          "type": "string",
          "description": "Unique identifier for this persona configuration.",
          "pattern": "^[a-z0-9_-]+$",
          "examples": [
            "ja_business_casual",
            "support_en",
            "sales_es"
          ]
        },
        "language": {
          "type": "string",
          "description": "ISO 639-1 language code.",
          "pattern": "^[a-z]{2}$",
          "examples": [
            "ja",
            "en",
            "es"
          ]
        },
        "context_culture": {
          "type": "string",
          "enum": [
            "high",
            "low",
            "mixed"
          ],
          "description": "Hall's high/low context culture classification. 'high' = implicit communication (e.g. Japanese), 'low' = explicit communication (e.g. American English), 'mixed' = context-dependent."
        },
        "formality_default": {
          "type": "string",
          "enum": [
            "formal",
            "semi_formal",
            "casual"
          ],
          "default": "semi_formal",
          "description": "Default formality level at conversation start."
        },
        "display_name": {
          "type": "string",
          "description": "Human-readable persona name for logging/debug.",
          "examples": [
            "日本語フリーランサー",
            "English Support Agent"
          ]
        },
        "version": {
          "type": "string",
          "pattern": "^\\d+\\.\\d+\\.\\d+$",
          "default": "0.1.0"
        }
      }
    },
    "timing": {
      "type": "object",
      "description": "Response timing configuration per platform. Humans don't reply instantly.",
      "required": [
        "platforms",
        "active_hours"
      ],
      "properties": {
        "platforms": {
          "type": "object",
          "description": "Platform-specific timing ranges in seconds.",
          "additionalProperties": {
            "type": "object",
            "required": [
              "min_delay",
              "max_delay"
            ],
            "properties": {
              "min_delay": {
                "type": "number",
                "minimum": 0,
                "description": "Minimum response delay in seconds."
              },
              "max_delay": {
                "type": "number",
                "minimum": 0,
                "description": "Maximum response delay in seconds."
              },
              "typing_indicator": {
                "type": "boolean",
                "default": false,
                "description": "Whether to show typing indicator during delay."
              }
            }
          },
          "examples": [
            {
              "chat": {
                "min_delay": 30,
                "max_delay": 180,
                "typing_indicator": true
              },
              "crowdsourcing": {
                "min_delay": 300,
                "max_delay": 900
              },
              "email": {
                "min_delay": 3600,
                "max_delay": 28800
              }
            }
          ]
        },
        "active_hours": {
          "type": "object",
          "required": [
            "start",
            "end"
          ],
          "properties": {
            "start": {
              "type": "string",
              "pattern": "^\\d{2}:\\d{2}$",
              "description": "Active hours start (HH:MM, 24h format)."
            },
            "end": {
              "type": "string",
              "pattern": "^\\d{2}:\\d{2}$",
              "description": "Active hours end (HH:MM, 24h format)."
            },
            "timezone": {
              "type": "string",
              "default": "UTC",
              "description": "IANA timezone identifier.",
              "examples": [
                "Asia/Tokyo",
                "America/New_York",
                "Europe/Madrid"
              ]
            }
          }
        },
        "night_queue": {
          "type": "boolean",
          "default": true,
          "description": "If true, messages received outside active hours are queued and sent at next active window."
        },
        "message_length_factor": {
          "type": "number",
          "minimum": 0,
          "maximum": 5,
          "default": 1.0,
          "description": "Multiplier for delay based on message length. Longer messages → longer 'reading' time."
        }
      }
    },
    "style": {
      "type": "object",
      "description": "Linguistic style variation settings. Uniformity is the #1 tell of AI.",
      "required": [
        "variation_patterns"
      ],
      "properties": {
        "variation_patterns": {
          "type": "object",
          "description": "Named pattern categories with example expressions. Keys are pattern types, values are arrays of template strings.",
          "additionalProperties": {
            "type": "array",
            "items": {
              "type": "string"
            },
            "minItems": 2
          },
          "examples": [
            {
              "confirmation": [
                "〇〇ということですね",
                "〇〇で合っていますか？",
                "〇〇と理解しました"
              ],
              "empathy": [
                "それは大変でしたね",
                "お気持ちわかります",
                "なるほど、そうだったんですね"
              ],
              "hedging": [
                "たぶん",
                "おそらく",
                "〜かもしれません",
                "〜と思います"
              ],
              "transition": [
                "話は変わりますが",
                "ところで",
                "別件ですが"
              ]
            }
          ]
        },
        "typo_rate": {
          "type": "number",
          "minimum": 0,
          "maximum": 0.1,
          "default": 0.005,
          "description": "Probability of introducing a plausible typo per character. Keep very low."
        },
        "punctuation_variance": {
          "type": "boolean",
          "default": true,
          "description": "Vary punctuation style (e.g. sometimes omit periods, use '...' vs '…')."
        },
        "sentence_length_variance": {
          "type": "object",
          "description": "Empirical: Human-Like CV=0.63 vs Formal CV=0.43 (DPO dataset, n=10,884, p<0.001).",
          "properties": {
            "min_ratio": {
              "type": "number",
              "default": 0.22,
              "description": "Minimum sentence length as ratio of average. Empirical value from DPO Human-Like distribution."
            },
            "max_ratio": {
              "type": "number",
              "default": 1.78,
              "description": "Maximum sentence length as ratio of average. Empirical value from DPO Human-Like distribution."
            }
          }
        },
        "filler_words": {
          "type": "array",
          "items": {
            "type": "string"
          },
          "description": "Language-specific filler words/phrases to occasionally insert.",
          "examples": [
            [
              "えーと",
              "あの",
              "そうですね"
            ],
            [
              "well",
              "um",
              "you know"
            ]
          ]
        },
        "emoji_policy": {
          "type": "string",
          "enum": [
            "never",
            "rare",
            "moderate",
            "frequent"
          ],
          "default": "rare",
          "description": "Frequency of emoji/emoticon usage."
        }
      }
    },
    "emotion": {
      "type": "object",
      "description": "Emotion state machine configuration. Humans' tone shifts over conversation lifetime.",
      "required": [
        "initial_state",
        "states",
        "transitions"
      ],
      "properties": {
        "initial_state": {
          "type": "string",
          "description": "Starting emotional state for new conversations.",
          "examples": [
            "polite_distant"
          ]
        },
        "states": {
          "type": "object",
          "description": "Named emotional states with behavioral parameters.",
          "additionalProperties": {
            "type": "object",
            "required": [
              "formality",
              "warmth",
              "verbosity"
            ],
            "properties": {
              "formality": {
                "type": "number",
                "minimum": 0,
                "maximum": 1,
                "description": "0 = very casual, 1 = very formal."
              },
              "warmth": {
                "type": "number",
                "minimum": 0,
                "maximum": 1,
                "description": "0 = cold/professional, 1 = warm/friendly."
              },
              "verbosity": {
                "type": "number",
                "minimum": 0,
                "maximum": 1,
                "description": "0 = terse, 1 = verbose."
              },
              "caution": {
                "type": "number",
                "minimum": 0,
                "maximum": 1,
                "default": 0.5,
                "description": "0 = bold/direct, 1 = very cautious/hedging."
              },
              "response_delay_multiplier": {
                "type": "number",
                "minimum": 0.5,
                "maximum": 3.0,
                "default": 1.0,
                "description": "Multiplier applied to base timing. Tense states → slower replies."
              }
            }
          },
          "examples": [
            {
              "polite_distant": {
                "formality": 0.9,
                "warmth": 0.3,
                "verbosity": 0.6,
                "caution": 0.7
              },
              "warming_up": {
                "formality": 0.7,
                "warmth": 0.5,
                "verbosity": 0.5,
                "caution": 0.5
              },
              "comfortable": {
                "formality": 0.5,
                "warmth": 0.7,
                "verbosity": 0.4,
                "caution": 0.3
              },
              "tense": {
                "formality": 0.8,
                "warmth": 0.2,
                "verbosity": 0.7,
                "caution": 0.9,
                "response_delay_multiplier": 1.5
              },
              "grateful": {
                "formality": 0.6,
                "warmth": 0.9,
                "verbosity": 0.5,
                "caution": 0.2
              },
              "efficient": {
                "formality": 0.4,
                "warmth": 0.5,
                "verbosity": 0.2,
                "caution": 0.2
              }
            }
          ]
        },
        "transitions": {
          "type": "array",
          "description": "Rules for state transitions based on triggers.",
          "items": {
            "type": "object",
            "required": [
              "from",
              "to",
              "trigger"
            ],
            "properties": {
              "from": {
                "type": "string",
                "description": "Source state name."
              },
              "to": {
                "type": "string",
                "description": "Target state name."
              },
              "trigger": {
                "type": "string",
                "description": "Event or condition that triggers this transition.",
                "examples": [
                  "turn_count >= 3",
                  "problem_detected",
                  "problem_resolved",
                  "turn_count >= 10"
                ]
              },
              "probability": {
                "type": "number",
                "minimum": 0,
                "maximum": 1,
                "default": 1.0,
                "description": "Probability of transition firing when trigger is met. < 1.0 adds natural unpredictability."
              }
            }
          }
        },
        "decay_rate": {
          "type": "number",
          "minimum": 0,
          "maximum": 1,
          "default": 0.1,
          "description": "Rate at which emotion intensity decays toward neutral per turn."
        }
      }
    },
    "context_reference": {
      "type": "object",
      "description": "How the persona references earlier parts of the conversation to show 'active listening'.",
      "properties": {
        "reference_probability": {
          "type": "number",
          "minimum": 0,
          "maximum": 1,
          "default": 0.4,
          "description": "Probability of referencing a previous message element per response."
        },
        "reference_templates": {
          "type": "array",
          "items": {
            "type": "string"
          },
          "description": "Template strings for back-references. {topic} is replaced with extracted topic.",
          "examples": [
            [
              "先ほどの{topic}の件ですが",
              "おっしゃる通り{topic}ですね",
              "{topic}とのことで、承知しました"
            ],
            [
              "Regarding {topic} you mentioned",
              "As you noted about {topic}",
              "Coming back to {topic}"
            ]
          ]
        },
        "max_lookback_turns": {
          "type": "integer",
          "minimum": 1,
          "maximum": 20,
          "default": 5,
          "description": "How many previous turns to consider for back-references."
        }
      }
    },
    "inner_shell": {
      "type": "object",
      "description": "Inner shell (individuality engine) parameters. Controls the 6 pillars: finitude, incompleteness, autonomous questioning, memory hierarchy, mutual recognition, and sleep cycle.",
      "properties": {
        "total_lifespan": {
          "type": "number",
          "minimum": 0.1,
          "default": 50.0,
          "description": "Total resource capacity of the agent's life arc. Determines when life-phase transitions occur."
        },
        "emotional_gap_intensity": {
          "type": "number",
          "minimum": 0,
          "maximum": 1,
          "default": 0.7,
          "description": "Intensity of the primary emotional gap (longing). Higher values produce stronger yearning for connection."
        },
        "emotional_gap_aware": {
          "type": "boolean",
          "default": true,
          "description": "Whether the agent is initially aware of its emotional gap. Unaware gaps surface gradually."
        },
        "knowledge_gap_intensity": {
          "type": "number",
          "minimum": 0,
          "maximum": 1,
          "default": 0.5,
          "description": "Intensity of the knowledge gap. Drives intellectual curiosity and learning behaviour."
        },
        "curiosity_domains": {
          "type": "object",
          "description": "Domain-to-interest mapping for the autonomous questioner. Keys are domain names, values are interest levels (0-1).",
          "additionalProperties": {
            "type": "number",
            "minimum": 0,
            "maximum": 1
          },
          "default": {
            "love": 0.6,
            "mortality": 0.5,
            "consciousness": 0.4
          }
        },
        "novelty_seeking": {
          "type": "number",
          "minimum": 0,
          "maximum": 1,
          "default": 0.5,
          "description": "Questioner's propensity for novel topics vs. revisiting familiar ones."
        },
        "depth_seeking": {
          "type": "number",
          "minimum": 0,
          "maximum": 1,
          "default": 0.5,
          "description": "Questioner's propensity for deep exploration vs. breadth."
        },
        "contradiction_sensitivity": {
          "type": "number",
          "minimum": 0,
          "maximum": 1,
          "default": 0.5,
          "description": "Questioner's sensitivity to contradictions in knowledge."
        },
        "memory_capacity": {
          "type": "integer",
          "minimum": 1,
          "default": 7,
          "description": "Working memory capacity (Miller's Law). Determines how many items can be held simultaneously."
        },
        "sleep_cycle_length": {
          "type": "number",
          "minimum": 0.1,
          "default": 16.0,
          "description": "Wake duration in time-units before drowsiness onset."
        },
        "seed": {
          "type": "integer",
          "description": "Random seed for reproducibility. Omit for default (42)."
        }
      }
    },
    "ambiguity": {
      "type": "object",
      "description": "Intentional imperfection settings. Overly precise answers betray AI.",
      "properties": {
        "hedge_probability": {
          "type": "number",
          "minimum": 0,
          "maximum": 0.5,
          "default": 0.08,
          "description": "Probability of adding hedging language per sentence. Empirical: Human-Like=0.082 vs Formal=0.017 (DPO dataset, n=10,884, p<0.001)."
        },
        "approximation_rules": {
          "type": "object",
          "properties": {
            "time_estimates": {
              "type": "boolean",
              "default": true,
              "description": "Add '程度' / 'approximately' to time estimates."
            },
            "numeric_rounding": {
              "type": "boolean",
              "default": true,
              "description": "Round precise numbers to human-friendly approximations."
            },
            "certainty_downgrade": {
              "type": "boolean",
              "default": true,
              "description": "Replace 'will' with 'should' / 'probably', etc."
            }
          }
        },
        "self_correction_rate": {
          "type": "number",
          "minimum": 0,
          "maximum": 0.1,
          "default": 0.043,
          "description": "Rate of self-corrections per sentence. Empirical: Human-Like=0.043 vs Formal=0.001 (DPO dataset, n=10,884, p<0.001)."
        }
      }
    }
  },
  "additionalProperties": false
}
